{
  "access": {
    "kubernetes": {
      "context": "context:611e49b22818",
      "identity": "identity:547a4b6a7894",
      "server": "server:6076e1dcf760"
    }
  },
  "artifact": {
    "path": "/shared/ci-skills-ci12-final-bf69d6d5-mac-20261018/node.iso",
    "pod": {
      "container": "ci-skills-pod",
      "image": "quay.io/coreos/coreos-installer@sha256:db8c1dc7aa5955613243c5cd73d2be58ae7b839873563dc44e0bf0a15e7fed71",
      "name": "ci-skills-run-tool-pod-0eaf9e7b6e574ee7",
      "namespace": "namespace:b115cbf8fccd",
      "restart_count": 0,
      "uid": "e1b7fa7a-9756-4c1c-8a11-49a790e6daa3"
    },
    "sha256": "a147f306fd4e10cfa0200e223720450e9bc0fd459657f223909672bdd26d3529",
    "size": 1379328000
  },
  "artifact_lifetime": "caller_selected_volume",
  "captured_at": "2026-10-18T04:24:43.057279+00:00",
  "cleanup": {
    "failures": [],
    "resources": [
      {
        "absent": true,
        "index": 2,
        "kind": "PodArtifact",
        "path": "/tmp/ci-skills-dependency-2",
        "status": "PASS"
      },
      {
        "absent": true,
        "kind": "Pod",
        "name": "ci-skills-run-tool-pod-0eaf9e7b6e574ee7",
        "namespace": "namespace:b115cbf8fccd",
        "status": "PASS"
      },
      {
        "absent": true,
        "kind": "ConfigMap",
        "name": "ci-skills-run-tool-pod-scripts-0eaf9e7b6e574ee7",
        "namespace": "namespace:b115cbf8fccd",
        "status": "PASS"
      }
    ],
    "retained": [
      {
        "kind": "configmap",
        "name": "ci-skills-run-node-artifact-record-0eaf9e7b6e574ee7",
        "namespace": "namespace:b115cbf8fccd"
      },
      {
        "kind": "configmap",
        "name": "ci-skills-run-node-artifact-recovery-0eaf9e7b6e574ee7",
        "namespace": "namespace:b115cbf8fccd"
      }
    ],
    "status": "PASS"
  },
  "errors": [],
  "filters": {},
  "kind": "ocp_node_onboard",
  "native_exit_code": 0,
  "operation": "build",
  "plan": {
    "functional_digest": "8dde2e6f7389ab60a1cf978d7ead63366e6b045cb422b2a7f82705f209084ff1",
    "inputs": {
      "destination": {
        "artifactPath": "/shared/ci-skills-ci12-final-bf69d6d5-mac-20261018/node.iso",
        "buildOutput": "destination",
        "mountPath": "/shared",
        "namespace": "namespace:b115cbf8fccd",
        "volumeSource": {
          "persistentVolumeClaim": {
            "claimName": "pvc:92a982289cbe"
          }
        }
      },
      "node_input": {
        "files": [],
        "mac_address": "02:00:00:10:00:01",
        "route": "flags"
      },
      "node_selector": {
        "kubernetes.io/arch": "amd64"
      },
      "pull_secret": "[REDACTED]",
      "release": {
        "cluster_release_architecture": "amd64",
        "cluster_release_image": "quay.io/openshift-release-dev/ocp-release@sha256:64d312cc715ccb58e44b7ed0a7a1a24ad407b72be2cb865512f9bf8ff7578524",
        "cluster_release_operating_system": "linux",
        "cluster_release_version": "4.19.26",
        "inspector_image": "quay.io/coreos/coreos-installer@sha256:db8c1dc7aa5955613243c5cd73d2be58ae7b839873563dc44e0bf0a15e7fed71",
        "oc_archive": "https://mirror.openshift.com/pub/openshift-v4/clients/ocp/4.19.26/openshift-client-linux-amd64-rhel9-4.19.26.tar.gz",
        "oc_archive_sha256": "be79bddaac8f2f59962c92063789fc726d8c8940cdb2dd04a708a1450a8277af",
        "source": "provider",
        "tool_fingerprint": "sha256:54c6f8e902200968a09d69a2d09d4afcff963e3f208f676e75191ae1211fe070"
      },
      "tool_pod": {
        "dependencies": [
          {
            "commands": [
              "coreos-installer"
            ],
            "name": "coreos-installer",
            "probe": [
              "coreos-installer",
              "--version"
            ]
          },
          {
            "commands": [
              "rsync"
            ],
            "name": "rsync",
            "probe": [
              "rsync",
              "--version"
            ],
            "yum": [
              "rsync"
            ]
          },
          {
            "commands": [
              "oc"
            ],
            "linux": {
              "destination": "/tmp/ci-skills-tools/bin",
              "files": [
                "oc"
              ],
              "method": "archive",
              "sha256": "be79bddaac8f2f59962c92063789fc726d8c8940cdb2dd04a708a1450a8277af",
              "stripComponents": 0,
              "url": "https://mirror.openshift.com/pub/openshift-v4/clients/ocp/4.19.26/openshift-client-linux-amd64-rhel9-4.19.26.tar.gz"
            },
            "name": "oc",
            "probe": [
              "oc",
              "version",
              "--client",
              "-o",
              "json"
            ]
          }
        ],
        "image": "quay.io/coreos/coreos-installer@sha256:db8c1dc7aa5955613243c5cd73d2be58ae7b839873563dc44e0bf0a15e7fed71"
      },
      "tool_source": "provider"
    },
    "kind": "ocp_node_onboard",
    "operation": "build",
    "run_id": "ci12-final-mac-bf69d6d5-20261018",
    "target": {
      "context": "context:611e49b22818",
      "server": "server:6076e1dcf760"
    },
    "timeout_seconds": 1800
  },
  "plan_digest": "dc86670086021f0979b5dbc2755adfe35a9e39c3f36571feb28109a8dc8928b8",
  "pod": {
    "container": "ci-skills-pod",
    "image": "quay.io/coreos/coreos-installer@sha256:db8c1dc7aa5955613243c5cd73d2be58ae7b839873563dc44e0bf0a15e7fed71",
    "name": "ci-skills-run-tool-pod-0eaf9e7b6e574ee7",
    "namespace": "namespace:b115cbf8fccd",
    "restart_count": 0,
    "uid": "e1b7fa7a-9756-4c1c-8a11-49a790e6daa3"
  },
  "readback": {
    "artifact_record": {
      "artifact": {
        "path": "/shared/ci-skills-ci12-final-bf69d6d5-mac-20261018/node.iso",
        "pod": {
          "container": "ci-skills-pod",
          "image": "quay.io/coreos/coreos-installer@sha256:db8c1dc7aa5955613243c5cd73d2be58ae7b839873563dc44e0bf0a15e7fed71",
          "name": "ci-skills-run-tool-pod-0eaf9e7b6e574ee7",
          "namespace": "namespace:b115cbf8fccd",
          "restart_count": 0,
          "uid": "e1b7fa7a-9756-4c1c-8a11-49a790e6daa3"
        },
        "sha256": "a147f306fd4e10cfa0200e223720450e9bc0fd459657f223909672bdd26d3529",
        "size": 1379328000
      },
      "destination": {
        "artifactPath": "/shared/ci-skills-ci12-final-bf69d6d5-mac-20261018/node.iso",
        "buildOutput": "destination",
        "mountPath": "/shared",
        "namespace": "namespace:b115cbf8fccd",
        "volumeSource": {
          "persistentVolumeClaim": {
            "claimName": "pvc:92a982289cbe"
          }
        }
      },
      "lifetime": "caller_selected_volume",
      "node_selector": {
        "kubernetes.io/arch": "amd64"
      },
      "run_id": "ci12-final-mac-bf69d6d5-20261018",
      "schema_version": "1.0",
      "storage": {
        "access_route": "storage:036cbdc14cbb",
        "artifact_path": "/shared/ci-skills-ci12-final-bf69d6d5-mac-20261018/node.iso",
        "build_output": "destination",
        "destination_fingerprint": "sha256:b5fb58be82069d314a821109678110aecd6fa08d03cebafa5baf01b2743145bb",
        "lifetime": "caller_selected_volume",
        "mount_path": "/shared",
        "namespace": "namespace:b115cbf8fccd",
        "observed_mount_path": "/shared",
        "output_absent": true,
        "protocol": "nfs4",
        "volume_source_types": [
          "persistentVolumeClaim"
        ],
        "writable": true
      },
      "tool_mounts": [
        {
          "mountPath": "/shared",
          "name": "artifact-destination",
          "readOnly": false,
          "volumeSource": {
            "persistentVolumeClaim": {
              "claimName": "pvc:92a982289cbe"
            }
          }
        },
        {
          "mountPath": "/ci-skills-work/ci12-final-mac-bf69d6d5-20261018",
          "name": "node-image-work",
          "readOnly": false,
          "volumeSource": {
            "emptyDir": {}
          }
        }
      ],
      "tool_spec": {
        "dependencies": [
          {
            "commands": [
              "coreos-installer"
            ],
            "name": "coreos-installer",
            "probe": [
              "coreos-installer",
              "--version"
            ]
          },
          {
            "commands": [
              "rsync"
            ],
            "name": "rsync",
            "probe": [
              "rsync",
              "--version"
            ],
            "yum": [
              "rsync"
            ]
          },
          {
            "commands": [
              "oc"
            ],
            "linux": {
              "destination": "/tmp/ci-skills-tools/bin",
              "files": [
                "oc"
              ],
              "method": "archive",
              "sha256": "be79bddaac8f2f59962c92063789fc726d8c8940cdb2dd04a708a1450a8277af",
              "stripComponents": 0,
              "url": "https://mirror.openshift.com/pub/openshift-v4/clients/ocp/4.19.26/openshift-client-linux-amd64-rhel9-4.19.26.tar.gz"
            },
            "name": "oc",
            "probe": [
              "oc",
              "version",
              "--client",
              "-o",
              "json"
            ]
          }
        ],
        "image": "quay.io/coreos/coreos-installer@sha256:db8c1dc7aa5955613243c5cd73d2be58ae7b839873563dc44e0bf0a15e7fed71"
      }
    },
    "destination_storage": {
      "access_route": "storage:036cbdc14cbb",
      "artifact_path": "/shared/ci-skills-ci12-final-bf69d6d5-mac-20261018/node.iso",
      "build_output": "destination",
      "destination_fingerprint": "sha256:b5fb58be82069d314a821109678110aecd6fa08d03cebafa5baf01b2743145bb",
      "lifetime": "caller_selected_volume",
      "mount_path": "/shared",
      "namespace": "namespace:b115cbf8fccd",
      "observed_mount_path": "/shared",
      "output_absent": true,
      "protocol": "nfs4",
      "volume_source_types": [
        "persistentVolumeClaim"
      ],